{
  "schema_version": "1.0",
  "failure_id": "aaaaaaaaaaaaaaaaaaaaaaaaaaaaaaaaaaaaaaaaaaaaaaaaaaaaaaaaaaaaaaaa",
  "kind": "dead_letter",
  "reason": "PROCESSING_FAILED",
  "source_topic": "ldv.accepted.v1",
  "source_partition": 0,
  "source_offset": "0",
  "payload_sha256": "d72bf994342a56102f88d61c43e535503b00dacf0ccdccfc364f8b1436976527",
  "observed_at": "2026-10-10T12:00:00.000Z",
  "original_base64": "ew0KICAiZXZlbnRfaWQiOiIwMDAwMDAwMC0wMDAwLTQwMDAtODAwMC0wMDAwMDAwMDAwMDEiLA0KICAic2NoZW1hX3ZlcnNpb24iOiIxLjAiLA0KICAic291cmNlX2FwcGxpY2F0aW9uIjoiZGVtby1zZXJ2aWNlIiwNCiAgInJlc3BvbnNpYmxlX3BhcnR5IjoiZXhhbXBsZS1tdW5pY2lwYWxpdHkiLA0KICAiY3JlYXRlZF9hdCI6IjIwMjYtMTAtMDhUMDc6MDA6MDBaIiwNCiAgInBheWxvYWQiOnsNCiAgICAidHJhY2VfaWQiOiIwMDAwMDAwMDAwMDAwMDAwMDAwMDAwMDAwMDAwMDAwMSIsDQogICAgInNwYW5faWQiOiIwMDAwMDAwMDAwMDAwMDAxIiwNCiAgICAicGFyZW50X3NwYW5faWQiOiIwMDAwMDAwMDAwMDAwMDAyIiwNCiAgICAibmFtZSI6IkRlbW86IHJhYWRwbGVnZW4gYWFudnJhYWciLA0KICAgICJzdGFydF90aW1lIjoxNzkxNDQyNzk4MDAwLA0KICAgICJlbmRfdGltZSI6MTc5MTQ0Mjc5OTAwMCwNCiAgICAic3RhdHVzIjoiT2siLA0KICAgICJhdHRyaWJ1dGVzIjp7DQogICAgICAiZHBsLmNvcmUucHJvY2Vzc2luZ19hY3Rpdml0eV9pZCI6Imh0dHBzOi8vcmVnaXN0ZXIuZXhhbXBsZS5pbnZhbGlkL3Byb2Nlc3NpbmctYWN0aXZpdGllcy9ERU1PLTAwMSIsDQogICAgICAiZHBsLmNvcmUuZGF0YV9zdWJqZWN0X2lkIjoiZXhhbXBsZS1zdWJqZWN0LW5vdC1yZWFsLTAwMSIsDQogICAgICAiZHBsLmNvcmUuZGF0YV9zdWJqZWN0X2lkX3R5cGUiOiJodHRwczovL3JlZ2lzdGVyLmV4YW1wbGUuaW52YWxpZC9pZGVudGlmaWVyLXR5cGVzL2Jzbi1wc2V1ZG9ueW0iLA0KICAgICAgImRwbC5wZC5jYXNlX2lkIjoiZXhhbXBsZS1jYXNlLW5vdC1yZWFsLTAwMSIsDQogICAgICAiZHBsLnBkLnNlcnZpY2VfaWQiOiJodHRwczovL2NhdGFsb2cuZXhhbXBsZS5pbnZhbGlkL3NlcnZpY2VzL2RlbW8tc2VydmljZSIsDQogICAgICAiZHBsLnBkLmNoYW5uZWwiOiJ3ZWIiDQogICAgfQ0KICB9DQp9"
}
